<?xml version="1.0" encoding="UTF-8"?>
<dataroot xmlns:od="urn:schemas-microsoft-com:officedata" xmlns:xsi="http://www.w3.org/2001/XMLSchema-instance" xsi:noNamespaceSchemaLocation="CHORONYM_CODES.xsd" generated="2013-11-25T16:36:12">
    <CHORONYM_CODES>
        <c_choronym_code>0</c_choronym_code>
        <c_choronym_desc>[Unknown]</c_choronym_desc>
        <c_choronym_chn>【未詳】</c_choronym_chn>
    </CHORONYM_CODES>
    <CHORONYM_CODES>
        <c_choronym_code>1</c_choronym_code>
        <c_choronym_desc>Anding</c_choronym_desc>
        <c_choronym_chn>安定</c_choronym_chn>
    </CHORONYM_CODES>
    <CHORONYM_CODES>
        <c_choronym_code>2</c_choronym_code>
        <c_choronym_desc>Chenliu</c_choronym_desc>
        <c_choronym_chn>陳留</c_choronym_chn>
    </CHORONYM_CODES>
    <CHORONYM_CODES>
        <c_choronym_code>3</c_choronym_code>
        <c_choronym_desc>Qiantang</c_choronym_desc>
        <c_choronym_chn>錢塘</c_choronym_chn>
    </CHORONYM_CODES>
    <CHORONYM_CODES>
        <c_choronym_code>4</c_choronym_code>
        <c_choronym_desc>Qinghe</c_choronym_desc>
        <c_choronym_chn>清河</c_choronym_chn>
    </CHORONYM_CODES>
    <CHORONYM_CODES>
        <c_choronym_code>6</c_choronym_code>
        <c_choronym_desc>Fanyang</c_choronym_desc>
        <c_choronym_chn>范陽</c_choronym_chn>
    </CHORONYM_CODES>
    <CHORONYM_CODES>
        <c_choronym_code>7</c_choronym_code>
        <c_choronym_desc>Peiguo</c_choronym_desc>
        <c_choronym_chn>沛國</c_choronym_chn>
    </CHORONYM_CODES>
    <CHORONYM_CODES>
        <c_choronym_code>8</c_choronym_code>
        <c_choronym_desc>Henei</c_choronym_desc>
        <c_choronym_chn>河內</c_choronym_chn>
    </CHORONYM_CODES>
    <CHORONYM_CODES>
        <c_choronym_code>9</c_choronym_code>
        <c_choronym_desc>Hongnong</c_choronym_desc>
        <c_choronym_chn>弘農</c_choronym_chn>
    </CHORONYM_CODES>
    <CHORONYM_CODES>
        <c_choronym_code>10</c_choronym_code>
        <c_choronym_desc>Runan</c_choronym_desc>
        <c_choronym_chn>汝南</c_choronym_chn>
    </CHORONYM_CODES>
    <CHORONYM_CODES>
        <c_choronym_code>11</c_choronym_code>
        <c_choronym_desc>Xingyang</c_choronym_desc>
        <c_choronym_chn>滎陽</c_choronym_chn>
    </CHORONYM_CODES>
    <CHORONYM_CODES>
        <c_choronym_code>12</c_choronym_code>
        <c_choronym_desc>Gaoping</c_choronym_desc>
        <c_choronym_chn>高平</c_choronym_chn>
    </CHORONYM_CODES>
    <CHORONYM_CODES>
        <c_choronym_code>13</c_choronym_code>
        <c_choronym_desc>Lean</c_choronym_desc>
        <c_choronym_chn>樂安</c_choronym_chn>
    </CHORONYM_CODES>
    <CHORONYM_CODES>
        <c_choronym_code>14</c_choronym_code>
        <c_choronym_desc>Luguo</c_choronym_desc>
        <c_choronym_chn>魯國</c_choronym_chn>
    </CHORONYM_CODES>
    <CHORONYM_CODES>
        <c_choronym_code>15</c_choronym_code>
        <c_choronym_desc>Longxi</c_choronym_desc>
        <c_choronym_chn>隴西</c_choronym_chn>
    </CHORONYM_CODES>
    <CHORONYM_CODES>
        <c_choronym_code>16</c_choronym_code>
        <c_choronym_desc>Nanyang</c_choronym_desc>
        <c_choronym_chn>南陽</c_choronym_chn>
    </CHORONYM_CODES>
    <CHORONYM_CODES>
        <c_choronym_code>17</c_choronym_code>
        <c_choronym_desc>Pengcheng</c_choronym_desc>
        <c_choronym_chn>彭城</c_choronym_chn>
    </CHORONYM_CODES>
    <CHORONYM_CODES>
        <c_choronym_code>18</c_choronym_code>
        <c_choronym_desc>Song Taizu</c_choronym_desc>
        <c_choronym_chn>宋太祖</c_choronym_chn>
    </CHORONYM_CODES>
    <CHORONYM_CODES>
        <c_choronym_code>19</c_choronym_code>
        <c_choronym_desc>Song Taizong</c_choronym_desc>
        <c_choronym_chn>宋太宗</c_choronym_chn>
    </CHORONYM_CODES>
    <CHORONYM_CODES>
        <c_choronym_code>20</c_choronym_code>
        <c_choronym_desc>Taiyuan</c_choronym_desc>
        <c_choronym_chn>太原</c_choronym_chn>
    </CHORONYM_CODES>
    <CHORONYM_CODES>
        <c_choronym_code>21</c_choronym_code>
        <c_choronym_desc>Waiqi</c_choronym_desc>
        <c_choronym_chn>外戚[刪]</c_choronym_chn>
    </CHORONYM_CODES>
    <CHORONYM_CODES>
        <c_choronym_code>22</c_choronym_code>
        <c_choronym_desc>Weiwang</c_choronym_desc>
        <c_choronym_chn>魏王</c_choronym_chn>
    </CHORONYM_CODES>
    <CHORONYM_CODES>
        <c_choronym_code>23</c_choronym_code>
        <c_choronym_desc>Wujun</c_choronym_desc>
        <c_choronym_chn>吳郡</c_choronym_chn>
    </CHORONYM_CODES>
    <CHORONYM_CODES>
        <c_choronym_code>24</c_choronym_code>
        <c_choronym_desc>Wuxing</c_choronym_desc>
        <c_choronym_chn>吳興</c_choronym_chn>
    </CHORONYM_CODES>
    <CHORONYM_CODES>
        <c_choronym_code>25</c_choronym_code>
        <c_choronym_desc>Wugong</c_choronym_desc>
        <c_choronym_chn>武功</c_choronym_chn>
    </CHORONYM_CODES>
    <CHORONYM_CODES>
        <c_choronym_code>26</c_choronym_code>
        <c_choronym_desc>Wuyue</c_choronym_desc>
        <c_choronym_chn>吳越</c_choronym_chn>
    </CHORONYM_CODES>
    <CHORONYM_CODES>
        <c_choronym_code>27</c_choronym_code>
        <c_choronym_desc>Yuzhang</c_choronym_desc>
        <c_choronym_chn>豫章</c_choronym_chn>
    </CHORONYM_CODES>
    <CHORONYM_CODES>
        <c_choronym_code>28</c_choronym_code>
        <c_choronym_desc>Zhaojun</c_choronym_desc>
        <c_choronym_chn>趙郡</c_choronym_chn>
    </CHORONYM_CODES>
    <CHORONYM_CODES>
        <c_choronym_code>29</c_choronym_code>
        <c_choronym_desc>Jingzhao</c_choronym_desc>
        <c_choronym_chn>京兆</c_choronym_chn>
    </CHORONYM_CODES>
    <CHORONYM_CODES>
        <c_choronym_code>30</c_choronym_code>
        <c_choronym_desc>Fufeng</c_choronym_desc>
        <c_choronym_chn>扶風</c_choronym_chn>
    </CHORONYM_CODES>
    <CHORONYM_CODES>
        <c_choronym_code>31</c_choronym_code>
        <c_choronym_desc>Dongping</c_choronym_desc>
        <c_choronym_chn>東平</c_choronym_chn>
    </CHORONYM_CODES>
    <CHORONYM_CODES>
        <c_choronym_code>32</c_choronym_code>
        <c_choronym_desc>Dongyang</c_choronym_desc>
        <c_choronym_chn>東陽</c_choronym_chn>
    </CHORONYM_CODES>
    <CHORONYM_CODES>
        <c_choronym_code>33</c_choronym_code>
        <c_choronym_desc>Wuwei</c_choronym_desc>
        <c_choronym_chn>武威</c_choronym_chn>
    </CHORONYM_CODES>
    <CHORONYM_CODES>
        <c_choronym_code>34</c_choronym_code>
        <c_choronym_desc>Hedong</c_choronym_desc>
        <c_choronym_chn>河東</c_choronym_chn>
    </CHORONYM_CODES>
    <CHORONYM_CODES>
        <c_choronym_code>36</c_choronym_code>
        <c_choronym_desc>Zhongshan</c_choronym_desc>
        <c_choronym_chn>中山</c_choronym_chn>
    </CHORONYM_CODES>
    <CHORONYM_CODES>
        <c_choronym_code>37</c_choronym_code>
        <c_choronym_desc>Fengyi</c_choronym_desc>
        <c_choronym_chn>馮翊</c_choronym_chn>
    </CHORONYM_CODES>
    <CHORONYM_CODES>
        <c_choronym_code>38</c_choronym_code>
        <c_choronym_desc>Guangling</c_choronym_desc>
        <c_choronym_chn>廣陵</c_choronym_chn>
    </CHORONYM_CODES>
    <CHORONYM_CODES>
        <c_choronym_code>39</c_choronym_code>
        <c_choronym_desc>Langye</c_choronym_desc>
        <c_choronym_chn>琅琊</c_choronym_chn>
    </CHORONYM_CODES>
    <CHORONYM_CODES>
        <c_choronym_code>41</c_choronym_code>
        <c_choronym_desc>Pingyang</c_choronym_desc>
        <c_choronym_chn>平陽</c_choronym_chn>
    </CHORONYM_CODES>
    <CHORONYM_CODES>
        <c_choronym_code>42</c_choronym_code>
        <c_choronym_desc>Bohai</c_choronym_desc>
        <c_choronym_chn>渤海</c_choronym_chn>
    </CHORONYM_CODES>
    <CHORONYM_CODES>
        <c_choronym_code>43</c_choronym_code>
        <c_choronym_desc>Tianshui</c_choronym_desc>
        <c_choronym_chn>天水</c_choronym_chn>
    </CHORONYM_CODES>
    <CHORONYM_CODES>
        <c_choronym_code>45</c_choronym_code>
        <c_choronym_desc>Yingchuan</c_choronym_desc>
        <c_choronym_chn>穎川</c_choronym_chn>
    </CHORONYM_CODES>
    <CHORONYM_CODES>
        <c_choronym_code>46</c_choronym_code>
        <c_choronym_desc>Xihe</c_choronym_desc>
        <c_choronym_chn>西河</c_choronym_chn>
    </CHORONYM_CODES>
    <CHORONYM_CODES>
        <c_choronym_code>47</c_choronym_code>
        <c_choronym_desc>Qiaoguo</c_choronym_desc>
        <c_choronym_chn>譙國</c_choronym_chn>
    </CHORONYM_CODES>
    <CHORONYM_CODES>
        <c_choronym_code>48</c_choronym_code>
        <c_choronym_desc>Henan</c_choronym_desc>
        <c_choronym_chn>河南</c_choronym_chn>
    </CHORONYM_CODES>
    <CHORONYM_CODES>
        <c_choronym_code>49</c_choronym_code>
        <c_choronym_desc>Jijun</c_choronym_desc>
        <c_choronym_chn>汲郡</c_choronym_chn>
    </CHORONYM_CODES>
    <CHORONYM_CODES>
        <c_choronym_code>51</c_choronym_code>
        <c_choronym_desc>Hejian</c_choronym_desc>
        <c_choronym_chn>河間</c_choronym_chn>
    </CHORONYM_CODES>
    <CHORONYM_CODES>
        <c_choronym_code>53</c_choronym_code>
        <c_choronym_desc>Guangping</c_choronym_desc>
        <c_choronym_chn>廣平</c_choronym_chn>
    </CHORONYM_CODES>
    <CHORONYM_CODES>
        <c_choronym_code>55</c_choronym_code>
        <c_choronym_desc>Wuchang</c_choronym_desc>
        <c_choronym_chn>武昌</c_choronym_chn>
    </CHORONYM_CODES>
    <CHORONYM_CODES>
        <c_choronym_code>57</c_choronym_code>
        <c_choronym_desc>Puyang</c_choronym_desc>
        <c_choronym_chn>濮陽</c_choronym_chn>
    </CHORONYM_CODES>
    <CHORONYM_CODES>
        <c_choronym_code>58</c_choronym_code>
        <c_choronym_desc>Julu</c_choronym_desc>
        <c_choronym_chn>鉅鹿</c_choronym_chn>
    </CHORONYM_CODES>
    <CHORONYM_CODES>
        <c_choronym_code>59</c_choronym_code>
        <c_choronym_desc>Shiping</c_choronym_desc>
        <c_choronym_chn>始平</c_choronym_chn>
    </CHORONYM_CODES>
    <CHORONYM_CODES>
        <c_choronym_code>61</c_choronym_code>
        <c_choronym_desc>Jiyang</c_choronym_desc>
        <c_choronym_chn>濟陽</c_choronym_chn>
    </CHORONYM_CODES>
    <CHORONYM_CODES>